{
  "schemaVersion": "1.0",
  "manifest": {
    "schemaVersion": "1.0",
    "id": "example.session.fixture",
    "version": "0.1.0",
    "kind": "session-provider",
    "protocol": {
      "major": 1,
      "minor": 0
    },
    "entrypoint": "module",
    "capabilities": [
      "session.lifecycle.v1",
      "session.atomic-guards.v1",
      "session.hooks.v1"
    ],
    "requiredCapabilities": [],
    "permissions": [
      "session.manage",
      "filesystem.workspace"
    ],
    "inputSchema": "input",
    "outputSchema": "output"
  },
  "module": "export function createExtension(configuration) { return { configuration }; }",
  "schemas": {
    "configuration": {
      "type": "object"
    },
    "input": {
      "type": "object"
    },
    "output": {
      "type": "object"
    }
  }
}
